{
  "Schema": "3.0",
  "OsKey": "Server2016",
  "Common": {
    "Build": 14393,
    "OsShortName": "WS2016",
    "Edition": "Datacenter",
    "Architecture": "x64",
    "WimEdition": "Windows Server 2016 Datacenter (Desktop Experience)",
    "InstallWimIndex": 4,
    "BootWimIndexes": [
      1,
      2
    ],
    "WinReWimPath": "Windows\\System32\\Recovery\\Winre.wim",
    "SupportedLanguages": [
      "en-us",
      "ja-jp"
    ],
    "DefaultLanguage": "en-us",
    "LCUExpandViaMum": false,
    "EnableInstallWimUpdate": true,
    "EnableBootWimUpdate": true,
    "EnableWinREUpdate": true,
    "_VerifiedDate": "2026-05-24T00:00:00+09:00",
    "_VerifiedBy": "manual:initial-r03"
  },
  "PatchBaseline": {
    "Schema": "3.0",
    "ChecksumAlgorithm": "SHA1"
  },
  "Pca2023": {
    "RequiredByDefault": true,
    "RequiredUpdateLevelKb": "2024-4B (April 2024 LCU) or later",
    "RequiredUpdateLevelMinDate": "2024-04-09",
    "NotesSource": [
      "https://support.microsoft.com/en-us/topic/updating-windows-bootable-media-to-use-the-pca2023-signed-boot-manager-d4064779-0e4e-43ac-b2ce-24f434fcfa0f",
      "https://github.com/microsoft/secureboot_objects/blob/main/scripts/windows/Make2023BootableMedia.ps1"
    ],
    "Notes": "Server 2016 GA media (Build 14393) is known to fail to boot on modern hardware with PCA2023-only Secure Boot firmware. Applying the LCU pipeline through P09 AssembleIso + P10 ConvertPca2023BootManager is the documented mitigation."
  },
  "AutoRefreshPolicy": {
    "Mode": "OnNewPatchTuesday",
    "WritebackToConfig": true,
    "FallbackOnScrapeFailure": "UseBaseline",
    "ScrapeRetries": 3
  },
  "LanguageSpecific": {
    "en-us": {
      "DisplayName": "English (United States)",
      "Iso": {
        "Url": "https://software-static.download.prss.microsoft.com/pr/download/Windows_Server_2016_Datacenter_EVAL_en-us_14393_refresh.ISO",
        "Sha256": "",
        "_VerifiedDate": "2026-05-26",
        "_VerifiedBy": "manual:r07.0-Step10-IsoUrl-refresh"
      },
      "VolumeLabelPrefix": "WS2016EN"
    },
    "ja-jp": {
      "DisplayName": "Japanese",
      "Iso": {
        "Url": "https://download.microsoft.com/download/E/0/9/E090BDF4-CA1D-4F2E-BC1C-232A946BC21D/14393.0.161119-1705.RS1_REFRESH_SERVER_EVAL_X64FRE_JA-JP.ISO",
        "Sha256": "",
        "_VerifiedDate": "2026-05-26",
        "_VerifiedBy": "manual:r07.0-Step10-IsoUrl-refresh"
      },
      "VolumeLabelPrefix": "WS2016JA"
    }
  },
  "PatchModel": "separate-ssu"
}
